{
	"schema_version": "ingestion_task_registry.v1",
	"source_family": "campus_services",
	"corpus": "campus_services",
	"collection": "service_guide",
	"tasks": [
		{
			"task_kind": "structured_projection_publish",
			"executor_kind": "ts_control",
			"input_contract": "campus_services_service_guide_source_truth.v1",
			"output_contract": "structured_projection_publish_closeout.v1",
			"can_publish_alias": false
		},
		{
			"task_kind": "alias_publish",
			"executor_kind": "ts_control",
			"input_contract": "ingestion_release_manifest.v1",
			"output_contract": "ingestion_alias_publish_closeout.v1",
			"can_publish_alias": true
		}
	]
}
