{
	"schema_version": "ingestion_task_registry.v1",
	"source_family": "regulations",
	"corpus": "regulations",
	"collection": "student_rules",
	"tasks": [
		{
			"task_kind": "source_truth_materialize",
			"executor_kind": "ts_control",
			"input_contract": "student_rules_raw_asset.v1",
			"output_contract": "student_rules_source_truth.v1",
			"can_publish_alias": false
		},
		{
			"task_kind": "canonical_document_materialize",
			"executor_kind": "ts_control",
			"input_contract": "student_rules_source_truth.v1",
			"output_contract": "canonical_document_artifacts.v1",
			"can_publish_alias": false
		},
		{
			"task_kind": "document_units_validate",
			"executor_kind": "rust_kernel",
			"kernel_id": "validate-document-units",
			"input_contract": "canonical_document_units.v1",
			"output_contract": "document_units_validation_report.v1",
			"can_publish_alias": false
		},
		{
			"task_kind": "chunk_prepare",
			"executor_kind": "rust_kernel",
			"kernel_id": "chunk-document-units",
			"input_contract": "canonical_document_units.v1",
			"output_contract": "ingestion_chunk_set.v1",
			"can_publish_alias": false
		},
		{
			"task_kind": "structured_projection_publish",
			"executor_kind": "ts_control",
			"input_contract": "student_rules_source_projections.v1",
			"output_contract": "structured_projection_publish_closeout.v1",
			"can_publish_alias": false
		},
		{
			"task_kind": "alias_publish",
			"executor_kind": "ts_control",
			"input_contract": "ingestion_release_manifest.v1",
			"output_contract": "ingestion_alias_publish_closeout.v1",
			"can_publish_alias": true
		}
	]
}
